<?xml version="1.0" encoding="UTF-8"?>
<!DOCTYPE Tests SYSTEM "TestCases.dtd">
<Tests>
<Test Exclude="" Number="1" Responsible="Hans-Georg " TestType="positive">
<Comment/>
<Run>
<Statement callable="false" ignore="false" verify="false">
<CallString>DELETE SYSLOADER.TRANSFORMATIONMODEL
</CallString>
</Statement>
<Statement callable="false" ignore="false" verify="false">
<CallString>USE USER DBA DBA</CallString>
</Statement>
<Statement callable="false" ignore="false" verify="false">
<CallString>SAVE CATALOG    ALL          INTO DBA.CATALOG</CallString>
</Statement>
<Statement callable="false" ignore="false" verify="false">
<CallString>INSERT INTO SYSLOADER.TRANSFORMATIONMODEL ( PACKAGEGUID,     STEPID  ,   CMD,    SEQ_NO,   OWNER,   SCHEMANAME,   TABLENAME,   TABLETYPE ) ( 
SELECT x'0200000004EDADF8BC080000C80F0000885F1FFD9F6E7CD5',  C.CMD_NO, C.CMD,  C.SEQ_NO, C.OWNER, C.SCHEMA    , C.TABLENAME, C.TABLETYPE  
FROM  DBA.CATALOG C, DOMAIN.USERS U  
WHERE   
U.ISREPLICATIONUSER NOT IN ('YES')  AND
C.OWNER         =  U.USERNAME       AND      
C.TYPE      NOT IN ('SYSTEM')       AND
C.SCHEMA    NOT IN ('PUBLIC','SYS') AND 
C.CMD_NO        IN ( SELECT C.CMD_NO  FROM DBA.CATALOG C WHERE 
                          ( C.CMD NOT LIKE 'GRANT %'     AND C.TABLETYPE IN  ( 'TABLE','VIEW','SYNONYM' ) AND C.SEQ_NO = 0 ) OR  
                          ( C.CMD     LIKE 'GRANT %' ) ) AND 
C.TABLENAME NOT IN ('CATALOG','SYSUPGRADEHISTORY') ) </CallString>
</Statement>
<Statement callable="false" ignore="false" verify="true">
<CallString>select distinct(owner) from SYSLOADER.TRANSFORMATIONMODEL WHERE packageguid = x'0200000004EDADF8BC080000C80F0000885F1FFD9F6E7CD5'</CallString>
<ResultSet Verification="Complete">
<ColumnDefinition>
<ColumnName>OWNER</ColumnName>
<ColumnType>CHAR</ColumnType>
</ColumnDefinition>
<Row>
<Value>'LOADER'</Value>
</Row>
</ResultSet>
</Statement>
</Run>
<CleanUp>
<Statement callable="false" ignore="false" verify="false">
<CallString>DROP TABLE DBA.CATALOG</CallString>
</Statement>
</CleanUp>
</Test>
<Test Exclude="" Number="2" Responsible="Hans-Georg " TestType="positive">
<Comment/>
<Run>
<Statement callable="false" ignore="false" verify="false">
<CallString>DELETE SYSLOADER.TRANSFORMATIONMODEL
</CallString>
</Statement>
<Statement callable="false" ignore="false" verify="false">
<CallString>USE USER LOADER LOADER</CallString>
</Statement>
<Statement callable="false" ignore="false" verify="false">
<CallString>SAVE CATALOG    USER          INTO LOADER.CATALOG</CallString>
</Statement>
<Statement callable="false" ignore="false" verify="false">
<CallString>INSERT INTO SYSLOADER.TRANSFORMATIONMODEL ( PACKAGEGUID,     STEPID  ,   CMD,    SEQ_NO,   OWNER,   SCHEMANAME,   TABLENAME,   TABLETYPE ) ( 
SELECT x'0200000004EDADF8BC080000C80F0000885F1FFD9F6E7CD5',  C.CMD_NO, C.CMD,  C.SEQ_NO, C.OWNER, C.SCHEMA    , C.TABLENAME, C.TABLETYPE  
FROM  LOADER.CATALOG C, DOMAIN.USERS U  
WHERE   
U.ISREPLICATIONUSER NOT IN ('YES')   AND
C.OWNER         =  U.USERNAME        AND      
C.TYPE      NOT IN ('SYSTEM')        AND
C.SCHEMA    NOT IN ('PUBLIC','SYS')  AND 
C.CMD_NO        IN ( SELECT C.CMD_NO  FROM LOADER.CATALOG C WHERE 
                          ( C.CMD NOT LIKE 'GRANT %'     AND C.TABLETYPE IN  ( 'TABLE','VIEW','SYNONYM' ) AND C.SEQ_NO = 0 ) OR  
                          ( C.CMD     LIKE 'GRANT %' ) ) AND 
C.TABLENAME NOT IN ('CATALOG','SYSUPGRADEHISTORY') ) </CallString>
</Statement>
<Statement callable="false" ignore="false" verify="true">
<CallString>select distinct(owner)  from SYSLOADER.TRANSFORMATIONMODEL WHERE packageguid = x'0200000004EDADF8BC080000C80F0000885F1FFD9F6E7CD5'</CallString>
<ResultSet Verification="Complete">
<ColumnDefinition>
<ColumnName>OWNER</ColumnName>
<ColumnType>CHAR</ColumnType>
</ColumnDefinition>
<Row>
<Value>'LOADER'</Value>
</Row>
</ResultSet>
</Statement>
</Run>
<CleanUp>
<Statement callable="false" ignore="false" verify="false">
<CallString>DROP TABLE LOADER.CATALOG</CallString>
</Statement>
</CleanUp>
</Test>
<Test Exclude="" Number="3" Responsible="Hans-Georg " TestType="positive">
<Comment/>
<Run>
<Statement callable="false" ignore="false" verify="false">
<CallString>DELETE SYSLOADER.TRANSFORMATIONMODEL
</CallString>
</Statement>
<Statement callable="false" ignore="false" verify="false">
<CallString>USE USER LOADER LOADER SCHEMA LOAD_SCHEMA_TEST501</CallString>
</Statement>
<Statement callable="false" ignore="false" verify="false">
<CallString>SAVE CATALOG OF SCHEMA LOAD_SCHEMA_TEST501     INTO LOAD_SCHEMA_TEST501.CATALOG
</CallString>
</Statement>
<Statement callable="false" ignore="false" verify="false">
<CallString>INSERT INTO SYSLOADER.TRANSFORMATIONMODEL ( PACKAGEGUID,     STEPID  ,   CMD,    SEQ_NO,   OWNER,   SCHEMANAME,   TABLENAME,   TABLETYPE ) ( 
SELECT x'0200000004EDADF8BC080000C80F0000885F1FFD9F6E7CD5',  C.CMD_NO, C.CMD,  C.SEQ_NO, C.OWNER, C.SCHEMA    , C.TABLENAME, C.TABLETYPE  
FROM  LOAD_SCHEMA_TEST501.CATALOG C, DOMAIN.USERS U  
WHERE   
U.ISREPLICATIONUSER NOT IN ('YES')   AND
C.OWNER         =  U.USERNAME        AND      
C.TYPE      NOT IN ('SYSTEM')        AND
C.SCHEMA    NOT IN ('PUBLIC','SYS')  AND 
C.CMD_NO        IN ( SELECT C.CMD_NO  FROM LOAD_SCHEMA_TEST501.CATALOG C WHERE 
                          ( C.CMD NOT LIKE 'GRANT %'     AND C.TABLETYPE IN  ( 'TABLE','VIEW','SYNONYM' ) AND C.SEQ_NO = 0 ) OR  
                          ( C.CMD     LIKE 'GRANT %' ) ) AND 
C.TABLENAME NOT IN ('CATALOG','SYSUPGRADEHISTORY') ) </CallString>
</Statement>
<Statement callable="false" ignore="false" verify="true">
<CallString>select distinct(schemaname)  from SYSLOADER.TRANSFORMATIONMODEL WHERE packageguid = x'0200000004EDADF8BC080000C80F0000885F1FFD9F6E7CD5'</CallString>
<ResultSet Verification="Complete">
<ColumnDefinition>
<ColumnName>SCHEMANAME</ColumnName>
<ColumnType>CHAR</ColumnType>
</ColumnDefinition>
<Row>
<Value>'LOAD_SCHEMA_TEST501'</Value>
</Row>
</ResultSet>
</Statement>
</Run>
<CleanUp>
<Statement callable="false" ignore="false" verify="false">
<CallString>DROP TABLE LOAD_SCHEMA_TEST501.CATALOG</CallString>
</Statement>
</CleanUp>
</Test>
<Test Exclude="" Number="4" Responsible="Hans-Georg " TestType="positive">
<Comment/>
<Run>
<Statement callable="false" ignore="false" verify="false">
<CallString>DELETE SYSLOADER.TRANSFORMATIONMODEL
</CallString>
</Statement>
<Statement callable="false" ignore="false" verify="false">
<CallString>USE USER LOADER LOADER SCHEMA FLOAD_SCHEMA_TEST501</CallString>
</Statement>
<Statement callable="false" ignore="false" verify="false">
<CallString>SAVE CATALOG OF FLOAD_SCHEMA_TEST501.FLOAD_TEST501 INTO FLOAD_SCHEMA_TEST501.CATALOG
</CallString>
</Statement>
<Statement callable="false" ignore="false" verify="false">
<CallString>INSERT INTO SYSLOADER.TRANSFORMATIONMODEL ( PACKAGEGUID,     STEPID  ,   CMD,    SEQ_NO,   OWNER,   SCHEMANAME,   TABLENAME,   TABLETYPE ) ( 
SELECT x'0200000004EDADF8BC080000C80F0000885F1FFD9F6E7CD5',  C.CMD_NO, C.CMD,  C.SEQ_NO, C.OWNER, C.SCHEMA    , C.TABLENAME, C.TABLETYPE  
FROM  FLOAD_SCHEMA_TEST501.CATALOG C, DOMAIN.USERS U  
WHERE   
U.ISREPLICATIONUSER NOT IN ('YES')  AND
C.OWNER         =  U.USERNAME       AND      
C.TYPE      NOT IN ('SYSTEM')       AND
C.SCHEMA    NOT IN ('PUBLIC','SYS') AND 
C.CMD_NO        IN ( SELECT C.CMD_NO  FROM FLOAD_SCHEMA_TEST501.CATALOG C WHERE 
                          ( C.CMD NOT LIKE 'GRANT %'     AND C.TABLETYPE IN  ( 'TABLE','VIEW','SYNONYM' ) AND C.SEQ_NO = 0 ) OR  
                          ( C.CMD     LIKE 'GRANT %' ) ) AND 
C.TABLENAME NOT IN ('CATALOG','SYSUPGRADEHISTORY') ) </CallString>
</Statement>
<Statement callable="false" ignore="false" verify="true">
<CallString>select distinct(tablename)  from SYSLOADER.TRANSFORMATIONMODEL WHERE packageguid = x'0200000004EDADF8BC080000C80F0000885F1FFD9F6E7CD5'</CallString>
<ResultSet Verification="Complete">
<ColumnDefinition>
<ColumnName>TABLENAME</ColumnName>
<ColumnType>CHAR</ColumnType>
</ColumnDefinition>
<Row>
<Value>'FLOAD_TEST501'</Value>
</Row>
</ResultSet>
</Statement>
</Run>
<CleanUp>
<Statement callable="false" ignore="false" verify="false">
<CallString>DROP TABLE FLOAD_SCHEMA_TEST501.CATALOG</CallString>
</Statement>
</CleanUp>
</Test>
</Tests>
