<?xml version="1.0" encoding="UTF-8"?>
<!DOCTYPE Tests SYSTEM "TestCases.dtd">
<Tests>
<Test Exclude="" Number="1" Responsible="Steffen Schildberg" TestType="positive">
<Comment>Test for PTS 1134919: Not all data of a table extracted because of a wrong computed packet size</Comment>
<Prepare>
<Statement callable="false" ignore="false"  verify="false">
<CallString>CREATE TABLE extract_test1(kseq integer, k500k integer, k250k integer, k100k integer, k40k integer,
k10k integer, k1k integer, k100 integer, k25 integer, k10 integer, k5 integer, k4 integer, k2 integer,
s1 char(8), s2 char(20), s3 char(20), s4 char(20), s5 char(20), s6 char(20),  s7 char(20), s8 char(20), primary key (kseq))</CallString>
</Statement>
</Prepare>
<Run>
<Statement callable="false" ignore="false"  verify="false">
<CallString>LOAD TABLE extract_test1
DATA INSTREAM FILE '&lt;infile_path&gt;extract_test1.data' COMPRESSED</CallString>
</Statement>
<Statement callable="false" ignore="false"  verify="false">
<CallString>EXTRACT TABLE extract_test1
DATA OUTSTREAM FILE '&lt;infile_path&gt;extract_test1_generated.data' PAGES</CallString>
</Statement>
<Statement callable="false" ignore="false"  verify="false">
<CallString>DELETE extract_test1</CallString>
</Statement>
<Statement callable="false" ignore="false"  verify="false">
<CallString>LOAD TABLE extract_test1
DATA INSTREAM FILE '&lt;infile_path&gt;extract_test1_generated.data' PAGES</CallString>
</Statement>
<Statement callable="false" ignore="false"  verify="true">
<CallString>SELECT COUNT(*) FROM extract_test1</CallString>
<ResultSet Verification="Complete">
<ColumnDefinition>
<ColumnName>EXPRESSION1</ColumnName>
<ColumnType>FIXED</ColumnType>
</ColumnDefinition>
<Row>
<Value>2500</Value>
</Row>
</ResultSet>
</Statement>
</Run>
</Test>
<Test Exclude="" Number="1131747" Responsible="Steffen Schildberg" TestType="positive">
<Comment>Check various possibilities to specify table names in Loader commands: names contain quotes itself</Comment>
<Prepare>
<Statement callable="false" ignore="false"  verify="false">
<CallString>CREATE TABLE "EXTRACT_""TEST1131747" ("A""A" INT, "B""""B" CHAR(10))</CallString>
</Statement>
</Prepare>
<Run>
<Statement callable="false" ignore="false"  verify="false">
<CallString>DATALOAD TABLE "EXTRACT_""TEST1131747"
INFILE '&lt;infile_path&gt;load_test1131747.data' </CallString>
</Statement>
<Statement callable="false" ignore="false"  verify="false">
<CallString>EXPORT TABLE "EXTRACT_""TEST1131747"
DATA OUTSTREAM FILE '&lt;infile_path&gt;extract_test1131747_generated_records.data'  records</CallString>
</Statement>
<Statement callable="false" ignore="false"  verify="false">
<CallString>DELETE "EXTRACT_""TEST1131747"</CallString>
</Statement>
<Statement callable="false" ignore="false"  verify="false">
<CallString>IMPORT TABLE "EXTRACT_""TEST1131747"
DATA INSTREAM FILE '&lt;infile_path&gt;extract_test1131747_generated_records.data'  records</CallString>
</Statement>
<Statement callable="false" ignore="false"  verify="true">
<CallString>SELECT COUNT(*) FROM "EXTRACT_""TEST1131747"</CallString>
<ResultSet Verification="Complete">
<ColumnDefinition>
<ColumnName>EXPRESSION1</ColumnName>
<ColumnType>FIXED</ColumnType>
</ColumnDefinition>
<Row>
<Value>3</Value>
</Row>
</ResultSet>
</Statement>
<Statement callable="false" ignore="false"  verify="false">
<CallString>EXPORT TABLE "EXTRACT_""TEST1131747"
DATA OUTSTREAM FILE '&lt;infile_path&gt;extract_test1131747_generated_pages.data'  pages</CallString>
</Statement>
<Statement callable="false" ignore="false"  verify="false">
<CallString>DELETE "EXTRACT_""TEST1131747"</CallString>
</Statement>
<Statement callable="false" ignore="false"  verify="false">
<CallString>IMPORT TABLE "EXTRACT_""TEST1131747"
DATA INSTREAM FILE '&lt;infile_path&gt;extract_test1131747_generated_pages.data'  pages</CallString>
</Statement>
<Statement callable="false" ignore="false"  verify="true">
<CallString>SELECT COUNT(*) FROM "EXTRACT_""TEST1131747"</CallString>
<ResultSet Verification="Complete">
<ColumnDefinition>
<ColumnName>EXPRESSION1</ColumnName>
<ColumnType>FIXED</ColumnType>
</ColumnDefinition>
<Row>
<Value>3</Value>
</Row>
</ResultSet>
</Statement>
</Run>
</Test>
<Test ErrorType="syntax" Exclude="" Number="1134813" Responsible="Steffen Schildberg" TestType="negative">
<Comment>test extract date values if the date and time format of the kernel is set to a format other than INTERNAL
PTS 1134813</Comment>
<Prepare>
<Statement callable="false" ignore="false"  verify="false">
<CallString>CREATE TABLE extract_test1134813(a date, b integer)</CallString>
</Statement>
</Prepare>
<Run>
<Statement callable="false" ignore="false"  verify="false">
<CallString>SET FORMAT ISO</CallString>
</Statement>
<Statement callable="false" ignore="false"  verify="false">
<CallString>INSERT INTO extract_test1134813 values ('1998-01-01', 1)</CallString>
</Statement>
<Statement callable="false" ignore="false"  verify="false">
<CallString>INSERT INTO extract_test1134813 values ('1999-01-01', 2)</CallString>
</Statement>
<Statement callable="false" ignore="false"  verify="false">
<CallString>INSERT INTO extract_test1134813 values ('2000-01-01', 3)</CallString>
</Statement>
<Statement callable="false" ignore="false"  verify="false">
<CallString>DATAEXTRACT * FROM extract_test1134813 OUTFIELDS
a 1
b 2
OUTFILE '&lt;infile_path&gt;extract_test1134813_generated.data'
DATE ISO</CallString>
</Statement>
<Statement callable="false" ignore="false"  verify="false">
<CallString>SET FORMAT INTERNAL</CallString>
</Statement>
<Statement callable="false" ignore="false"  verify="false">
<CallString>DELETE extract_test1134813</CallString>
</Statement>
<Statement callable="false" ignore="false"  verify="false">
<CallString>LOAD TABLE extract_test1134813
DATA INSTREAM FILE '&lt;infile_path&gt;extract_test1134813_generated.data'
DATE ISO</CallString>
</Statement>
<Statement callable="false" ignore="false"  verify="true">
<CallString>SELECT * FROM extract_test1134813</CallString>
<ResultSet Verification="Complete">
<ColumnDefinition>
<ColumnName>A</ColumnName>
<ColumnType>DATE</ColumnType>
</ColumnDefinition>
<ColumnDefinition>
<ColumnName>B</ColumnName>
<ColumnType>INT</ColumnType>
</ColumnDefinition>
<Row>
<Value>'1998-01-01'</Value>
<Value>1</Value>
</Row>
<Row>
<Value>'1999-01-01'</Value>
<Value>2</Value>
</Row>
<Row>
<Value>'2000-01-01'</Value>
<Value>3</Value>
</Row>
</ResultSet>
</Statement>
</Run>
</Test>
<Test Exclude="" Number="1136604" Responsible="Steffen Schildberg" TestType="positive">
<Comment>Tests releasing locks after unsuccessful export of data of a single table. The error is only simulated by a row not found error (requesting to start
extraction with row 3 where the table contains only 1 row of data) which would as any other error lock the table.
PTS 1136604</Comment>
<Prepare>
<Statement callable="false" ignore="false"  verify="false">
<CallString>CREATE TABLE extract_test1136604(a char(3))</CallString>
</Statement>
</Prepare>
<Run>
<Statement callable="false" ignore="false"  verify="false">
<CallString>INSERT INTO extract_test1136604 values ('111')</CallString>
</Statement>
<Statement callable="false" ignore="false"  verify="false">
<CallString>EXPORT TABLE extract_test1136604 
DATA OUTSTREAM FILE '&lt;infile_path&gt;extract_test1136604_generated.data'
START 3 10</CallString>
</Statement>
<Statement callable="false" ignore="false"  verify="true">
<CallString>SELECT count(*) FROM locks where tablename = 'EXTRACT_TEST1136604'</CallString>
<ResultSet Verification="Complete">
<ColumnDefinition>
<ColumnName>EXPRESSION1</ColumnName>
<ColumnType>FIXED</ColumnType>
</ColumnDefinition>
<Row>
<Value>0</Value>
</Row>
</ResultSet>
</Statement>
</Run>
</Test>
</Tests>
