<?xml version="1.0" encoding="UTF-8"?>
<!DOCTYPE Tests SYSTEM "TestCases.dtd">
<Tests>
<Test Exclude="" Number="1" Responsible="Ileana Somesan" TestType="positive">
<Comment>Load data of 2 columns of the table import_table.test51 into table import_table.test251 in format RECORDS; the test extracts the data itself</Comment>
<Prepare>
<Statement callable="false" ignore="false"  verify="false">
<CallString>CREATE TABLE import_table.test252 (a CHAR(10), b CHAR(10), c CHAR(10), PRIMARY KEY(a))</CallString>
</Statement>
</Prepare>
<Run>
<Statement callable="false" ignore="false"  verify="false">
<CallString>EXPORT COLUMNS a,b  from import_table.test51
data outstream  '&lt;infile_path&gt;load_test252_generated.data' RECORDS
</CallString>
</Statement>
<Statement callable="false" ignore="false"  verify="false">
<CallString>IMPORT TABLE import_table.test252
DATA INSTREAM  '&lt;infile_path&gt;load_test252_generated.data' RECORDS
A   1
B   2

</CallString>
</Statement>
<Statement callable="false" ignore="false"  verify="true">
<CallString>SELECT * FROM import_table.test252</CallString>
<ResultSet Verification="Complete">
<ColumnDefinition>
<ColumnName>A</ColumnName>
<ColumnType>CHAR</ColumnType>
</ColumnDefinition>
<ColumnDefinition>
<ColumnName>B</ColumnName>
<ColumnType>CHAR</ColumnType>
</ColumnDefinition>
<ColumnDefinition>
<ColumnName>C</ColumnName>
<ColumnType>CHAR</ColumnType>
</ColumnDefinition>
<Row>
<Value>'aaa'</Value>
<Value>'klmno'</Value>
<Value>NULL</Value>
</Row>
<Row>
<Value>'aab'</Value>
<Value>'klmno'</Value>
<Value>NULL</Value>
</Row>
<Row>
<Value>'bbb'</Value>
<Value>'klmno'</Value>
<Value>NULL</Value>
</Row>
<Row>
<Value>'ccc'</Value>
<Value>'klmno'</Value>
<Value>NULL</Value>
</Row>
<Row>
<Value>'d_p'</Value>
<Value>'klmno'</Value>
<Value>NULL</Value>
</Row>
<Row>
<Value>'jjH4'</Value>
<Value>'kljf'</Value>
<Value>NULL</Value>
</Row>
<Row>
<Value>'mmKU'</Value>
<Value>'arhg'</Value>
<Value>NULL</Value>
</Row>
<Row>
<Value>'ooTD'</Value>
<Value>'atzt'</Value>
<Value>NULL</Value>
</Row>
</ResultSet>
</Statement>
</Run>
</Test>
<Test ErrorType="syntax" Exclude="" Number="2" Responsible="Ileana Somesan" TestType="negative">
<Comment>Test file format options syntactically: 
- codeset not available as option
- only possible codetypes are UCS2, UTF8 and ASCII
- only possible format specifications in case of data streams are FORMATTED, COMPRESSED, PAGES, RECORDS
</Comment>
<Run>
<Statement callable="false" ignore="true" verify="false">
<CallString>IMPORT TABLE import_table.test1 DATA INSTREAM  'test.data' codeset ISO8859-1</CallString>
<Error>
<ErrorCode>-25281</ErrorCode>
<ErrorMessage>Syntax error</ErrorMessage>
</Error>
</Statement>
<Statement callable="false" ignore="true" verify="false">
<CallString>IMPORT TABLE import_table.test1 DATA INSTREAM  'test.data' some_name</CallString>
<Error>
<ErrorCode>-25281</ErrorCode>
<ErrorMessage>Syntax error</ErrorMessage>
</Error>
</Statement>
<Statement callable="false" ignore="true" verify="false">
<CallString>IMPORT TABLE import_table.test1
DATA INSTREAM  'test.data' COMPRESS 
A 1
B 2
</CallString>
<Error>
<ErrorCode>-25281</ErrorCode>
<ErrorMessage>Syntax error</ErrorMessage>
</Error>
</Statement>
<Statement callable="false" ignore="true" verify="false">
<CallString>IMPORT TABLE import_table.test1
DATA INSTREAM  'test.data' FORMATT
A 1- 10
B 11 - 20
</CallString>
<Error>
<ErrorCode>-25233</ErrorCode>
<ErrorMessage>Some column descriptions with end position but file format is COMPRESSED.</ErrorMessage>
</Error>
</Statement>
</Run>
</Test>
<Test ErrorType="syntax" Exclude="" Number="3" Responsible="Ileana Somesan" TestType="negative">
<Comment>Test external column data types syntactically:
1. INTEGER requires file format FORMATTED; no need to create the table nor to have the data file
2. INTEGER requires 2 or 4 Byte long fields</Comment>
<Run>
<Statement callable="false" ignore="false" verify="false">
<CallString>IMPORT TABLE import_table.test5
DATA INSTREAM  'load_test5.data'
A  1 INTEGER
B 2
</CallString>
<Error>
<ErrorCode>-25216</ErrorCode>
<ErrorMessage>File option FORMATTED required.</ErrorMessage>
</Error>
</Statement>
<Statement callable="false" ignore="false" verify="false">
<CallString>IMPORT TABLE import_table.test5
DATA INSTREAM  'load_test5.data' FWV
A  1-3   INTEGER
B  4-8  
</CallString>
<Error>
<ErrorCode>-25201</ErrorCode>
<ErrorMessage>Column "A" - INTEGER field: 1, 2 or 4 bytes long, (double if HEX).</ErrorMessage>
</Error>
</Statement>
<Statement callable="false" ignore="false" verify="false">
<CallString>IMPORT TABLE import_table.test5
DATA INSTREAM  'load_test5.data' FWV
A  1-5   INTEGER
B  6-10  
</CallString>
<Error>
<ErrorCode>-25201</ErrorCode>
<ErrorMessage>Column "A" - INTEGER field: 1, 2 or 4 bytes long, (double if HEX).</ErrorMessage>
</Error>
</Statement>
</Run>
</Test>
</Tests>
