<?xml version="1.0" encoding="UTF-8"?>
<!DOCTYPE Tests SYSTEM "TestCases.dtd">
<Tests>
<Test ErrorType="syntax" Exclude="" Number="1" Responsible="" TestType="negative">
<Comment/>
<Run>
<Statement callable="false" ignore="false" verify="false">
<CallString>EXPORT DB 
CATALOG OUTSTREAM '&lt;infile_path&gt;Ev77_test1_pages.catalog'
DATA OUTSTREAM '&lt;infile_path&gt;Ev77_test1_pages.data'  PAGES</CallString>
<Error>
<ErrorCode>-25331</ErrorCode>
<ErrorMessage>This is a restricted statement, user must be SYSDBA</ErrorMessage>
</Error>
</Statement>
<Statement callable="false" ignore="false" verify="false">
<CallString>EXPORT DB 
CATALOG OUTSTREAM '&lt;infile_path&gt;Ev77_test1_records.catalog'
DATA OUTSTREAM '&lt;infile_path&gt;Ev77_test1_records.data' RECORDS</CallString>
<Error>
<ErrorCode>-25331</ErrorCode>
<ErrorMessage>This is a restricted statement, user must be SYSDBA</ErrorMessage>
</Error>
</Statement>
</Run>
</Test>
</Tests>
